{
  "$schema": "https://json-schema.org/draft/2020-12/schema",
  "title": "DotfilesScaffoldConfig",
  "type": "object",
  "additionalProperties": false,
  "required": ["projectName"],
  "properties": {
    "projectName": {
      "type": "string",
      "pattern": "^[a-z][a-z0-9-]*$",
      "description": "Root package name and default directory label."
    },
    "scope": {
      "type": "string",
      "pattern": "^@[a-z][a-z0-9-]*$",
      "description": "npm workspace scope used for apps and packages (defaults to @projectName)."
    },
    "description": {
      "type": "string"
    },
    "apps": {
      "type": "array",
      "minItems": 1,
      "items": {
        "type": "object",
        "additionalProperties": false,
        "required": ["type", "name"],
        "properties": {
          "type": {
            "type": "string",
            "enum": ["frontend_app", "node_backend"]
          },
          "name": {
            "type": "string",
            "pattern": "^[a-z][a-z0-9-]*$"
          },
          "database": {
            "description": "Opt-in. When present, install packages/query-adapter and the Knex overlay. Default --example omits this. true is postgres + sqlite-pg-proxy tests.",
            "anyOf": [
              { "type": "boolean" },
              {
                "type": "object",
                "additionalProperties": false,
                "properties": {
                  "dialect": {
                    "type": "string",
                    "enum": ["postgres", "sqlite"],
                    "default": "postgres"
                  },
                  "testStrategy": {
                    "type": "string",
                    "enum": ["sqlite-pg-proxy", "sqlite", "postgres"]
                  }
                }
              }
            ]
          }
        }
      }
    },
    "packages": {
      "type": "array",
      "minItems": 3,
      "maxItems": 3,
      "uniqueItems": true,
      "items": {
        "type": "string",
        "enum": ["tsconfig", "types", "util"]
      }
    }
  }
}
